title,selftext,score,num_comments,url
r/RocketLab Stock Discussion Thread,"You can use this thread to discuss the RocketLab stock and things related to it.

Selfpost and Memes related to the stock / stockprice will be removed outside of this thread according to Rule 2.",3,15,https://www.reddit.com/r/RocketLab/comments/1g0vox9/rrocketlab_stock_discussion_thread/
[Rocket Lab on X] It’s beginning to look a lot like Christmas... and a Neutron launch pad! ,,190,21,https://x.com/RocketLab/status/1868389536558157981?t=M9KWL0wcPv8cDNWRlucfjA&s=19
RocketLab successfully launched the 3rd HASTE rocket from wallops island VA on 12/13 at 8pm EST!,,232,10,https://x.com/StarShip_S24/status/1867745181258088818?t=iBr-OCx-D3O4EdktWCsKhg&s=34
RocketLab employee,"We are down in Disneyland and were leaving Downtown Disney when I saw someone in a Tshirt with RL logo on the back and it said “Mission Team” on the back. I lean over to my wife and say “holy shit that dude works for RocketLab!” She’s like what’s that? I side eye her and proceed to go up to the fella and tap him on the shoulder and ask “excuse me do you work for RL?” He said ya! And I completely geeked out and was like a little kid talking to an astronaut or something. I don’t have any idea why but it was just really cool for me to meet someone from the company. His wife or gf got a good chuckle out of it though. Anyway that was my story and brush with greatness. I love this company and am excited for its future. Wish I could have a “mission team” shirt but that’s some shit you gotta earn I feel like. 

Sorry if this doesn’t adhere to the subs rules. I just had to share. ",417,38,https://www.reddit.com/r/RocketLab/comments/1hddu47/rocketlab_employee/
ESCAPADE looking at 2025 and 2026 launch options - SpaceNews,"The twin spacecraft, which had been shipped to Florida a few weeks before the previously scheduled launch, are now back in Rocket Lab’s facility in Long Beach, California. ",35,9,https://spacenews.com/escapade-looking-at-2025-and-2026-launch-options/
China mineral bans and Rocket Lab?,Are the Chinese bans on rare earth mineral exports going to affect Rocket Lab? ,0,9,https://www.reddit.com/r/RocketLab/comments/1hdtpd4/china_mineral_bans_and_rocket_lab/
What’s Rocket Lab’s Secret Sauce for Competing with Industry Giants?,"What is it that truly sets Rocket Lab apart from its competitors and makes it a viable contender in an industry dominated by massive companies with seemingly unlimited budgets and room for trial and error? To succeed against these giants, it seems like a company must excel in certain key areas. Can anyone shed light on the specific strengths or strategies that Rocket Lab employs to stay competitive? Additionally, is there a clear timeline or roadmap for their future beyond the development of the Neutron rocket?",4,25,https://www.reddit.com/r/RocketLab/comments/1hb9i4e/whats_rocket_labs_secret_sauce_for_competing_with/
Blue Origin VS Rocketlab Cost Per KG,"I have been a long-time Rocketlab supporter and investor and will be for the foreseeable future. I am curious though on how everyone feels about the eventual competition from Blue Origin. Blue Origin is projecting I believe around a $1500 cost per KG via New Glenn vs Rocket Lab's $3,846 per kg for Neutron. 

These both have a ways to go before being realized and I have a hard time believing that Blue Origin can meet that price target but one thing they can do is subsidize the cost via Bezos and drive out most of the competition. ",29,31,https://www.reddit.com/r/RocketLab/comments/1hak2ik/blue_origin_vs_rocketlab_cost_per_kg/
Amazing read on RocketLab,https://x.com/tradexwhisperer/status/1855456157911105799?s=46&t=yHa1TukIuNby80KwiP5n_Q,60,10,https://www.reddit.com/r/RocketLab/comments/1ha1oxd/amazing_read_on_rocketlab/
Moat chat,"First off this ain't a DD. This is a motivational wake up to what is actually happening. 


Every month that rocketlab is running, is the moat.


This ain't a 7/11 franchise. This is a business that has all the knowledge and engineering to get to space. Every day, every week, every month something new is learned that gives them an edged. All the layers beyond just a rocket, rocketlab already is refining and gaining new plans and partnerships.


All their previous launches, all that experience, gaining customers, a proven track record, refining, adapting, tweaking, integrating. Rocketlab building parts, building platforms, launching, monitoring, landing, building a process, refining a process.


The amount of experience, retaining customers, providing new experiences and solutions for customers...


...that is the moat. Doing the hard thing, doing it well, and most importantly already doing it. There isn't hopium, there isn't promises, they are already doing it.


Others haven't even scratched the surface of what that all entails. They don't have all the additional staff, processes, customers, solutions, platforms, they are stuck on figuring out step one. They are blowing millions, billions, without even a foundation of a business yet.


Rocketlab is so far ahead that they have a wild tech/intelligence/platform moat that is still far unrealized compared to their stock worth.


I am actually incredibly excited because a lot of this is still to be discovered by others. You really need to grasp how much rocketlab has already accomplished and how fast they are moving on neutron and space systems. Like, this ain't a shop that sells loaves of bread(nothing against a good sour dough, promise). They made a business that escapes the atmosphere, literally leaving the planet to find new opportunities. That is something once only held by the wealthiest and most knowledgable countries. Now we have it from rocketlab, where we individually have the ability, through its stock, to be a part of it. Literally nerd heaven.


Owning some rocketlab stock puts us right there in time, in the history of humanity where we are transitioning to space. Like imagine what you can tell your kids, nephews and neices or grand kids.


The wonderful thing is, you don't even have to imagine, you just do it, and you are a part of all this. Own a piece of this awesomeness. Help make sure it all happens, promote it, champion it. 


I just don't even know what else to say!!! It's so damn exciting.

",31,7,https://www.reddit.com/r/RocketLab/comments/1ha3iq2/moat_chat/
Dave G Investing interview with Rocket Lab team. Very informative.,,79,15,https://youtu.be/jjoJn0qiyTc?feature=shared
Trump Choice for NASA Will Help Space Industry: Rocket Lab CEO,,172,14,https://www.bnnbloomberg.ca/business/company-news/2024/12/05/trump-choice-for-nasa-will-help-space-industry-rocket-lab-ceo/
Rocket Lab competitors? ,"Currently what other companies (other than SpaceX) are seen as direct competitors to Rocket Lab, and if any -  are they as far along in the process of developing medium size rockets to send out rocket lab is? What separates Rocket Lab from all the other companies that drives the hype for Rocket Lab? ",8,26,https://www.reddit.com/r/RocketLab/comments/1h6pbnl/rocket_lab_competitors/
"[Rocket Lab on X] Latest Archimedes hotfire pictures have dropped‍🔥 We’ve doubled our engine test cadence these past months, rapidly implementing tweaks to Archimedes on the test stand at the Stennis Space Center in Mississippi.",,233,5,https://x.com/RocketLab/status/1864079163986227270?t=_JC_xSMjOoLeh7-l-aFN6A&s=19
Given who Trump Picked to head NASA what are the chances that they now funnel contracts to SpaceX?,Curious to hear everyone’s thoughts given that Musk spent hundreds of millions to get Trump elected and he will be expecting an ROI? How do you think this will impact Rocket Lab?,4,75,https://www.reddit.com/r/RocketLab/comments/1h6mhm8/given_who_trump_picked_to_head_nasa_what_are_the/
Venus Life Finder 30 Dec 2024?!,"Hi,

i found the Venus Life Finder Mission which is a Collaborarion between Rocket Lab and the MIT.

Its date is 30th of Dezember 2024.
https://en.m.wikipedia.org/wiki/Venus_Life_Finder

Is this date still valid?",25,9,https://www.reddit.com/r/RocketLab/comments/1h4uzvn/venus_life_finder_30_dec_2024/
Merch STORE,"Guys, give me your vote for what you’d like to see in the merch store. I posted this on another chat, here are some of the things mentioned there.

Hoodies, Crew Neck T-shirt, 3D Printed Scale Models, Lego Toy Model Sets, Phone Cases, Dildo, Sunglasses, More Mugs, Different Colored Tshirts, Affordable Launch Coin, More Hats, Golf Balls, an Edible Hat. 

https://shop.rocketlabusa.com/",57,53,https://www.reddit.com/r/RocketLab/comments/1h45jnx/merch_store/
Let's just imagine... what happens to Rocket Lab post-contact from Aliens?,"I know it is a taboo subject with a million different theories or beliefs. With all the congress hearings lately claiming UAPs are real, they are here, they hypothesize how they work within our understanding of physics but all agree the technology is not ours.

Let's just play pretend and all of that is 100% real and all of a sudden some alien race made contact and we got access to their gravitational propulsion technology, and are able to travel between our atmosphere, space, other planets, etc all very fast.

Does Rocket Lab just immediately become obsolete and tank? I suppose even if we don't need launch vehicles like rockets, the satellite components business would still be in full operation and working.

Or maybe it is a massive catalyst in humanity's drive for space and motivation to become interplanetary. All of a sudden rocket launches and satellites are #1, 2 and 3 priority and get massive attention and funding.

I thought this would be a fun thought experiment and conversation if we all think outside the box and think open minded!

Disclosure: Love SPB, huge fan of this company, long term shareholder, and definetly think ETs are real and here",0,8,https://www.reddit.com/r/RocketLab/comments/1h4llua/lets_just_imagine_what_happens_to_rocket_lab/
4 million in insider sales this Thanksgiving week. ,Rocketlab employees getting their families some nice Christmas gifts I guess. ,111,18,https://i.redd.it/42lhnt6w2v3e1.jpeg
Rocket Lab Signs $23.9M CHIPS Incentives Award to Boost Semiconductor Manufacturing,,217,6,https://www.rocketlabusa.com/updates/rocket-lab-signs-23-9m-chips-incentives-award-to-boost-semiconductor-manufacturing-2
Rocket Lab on X: Mission success. 2 launches in less than 24 hours from 2 pads in 2 different hemispheres.,,303,12,https://x.com/RocketLab/status/1860913265121038639
“Commercial communications companies should be soul searching”… -Peter Beck,"Yes they should - shots fired. 

Actually… Sir Peter Beck dropping dynamite 🧨 for a disrupted telecommunications future… 

We knew the infrastructure/applications piece was likely going to meld and come kick some ass at some point. 

Now you really understand why Verizon HAD to invest ASTS… they shit themselves one night and said holy F our future is not guaranteed…. 

Peter Beck be like… Own the high ground and the keys to the high ground bitches… or it comes through us. 

You all see how this is playing out ladies and gentlemen? 

RKLB might be the 2nd most valuable company on earth in 10 years, behind their biggest competitor. 

Hope you all listened to this entire interview (go to 49:50):

https://youtu.be/FdrKAc2AYZc?si=TtdrXDhyCR_nf_46

Source: @payloadspace on YouTube ",59,18,https://www.reddit.com/r/RocketLab/comments/1gviidt/commercial_communications_companies_should_be/
Is Rocket Lab working on a rocket larger than Neutron?,,36,58,https://www.reddit.com/r/RocketLab/comments/1gvhhoo/is_rocket_lab_working_on_a_rocket_larger_than/
"End-to-End Space, with Peter Beck (CEO of Rocket Lab)","This week on Pathfinder, we’re excited to welcome the one and only Peter Beck, founder and CEO of Rocket Lab. Rocket Lab continues to solidify its position as a leading end-to-end space company, offering launch services, spacecraft platforms, and in-house satellite manufacturing.

In light of Rocket Lab’s Q3 earnings report, which saw a 55% year-over-year revenue increase and a growing backlog of over $1B, this episode dives deep into the company’s strategic and operational decisions driving its success. 

In addition, we discuss:
– Rocket Lab’s journey from its early days to becoming the world’s third most frequent launch provider
– The development of Neutron and its significance in addressing medium-class launch demand
– Peter’s philosophy on efficient engineering and capital allocation
– The rise of Rocket Lab’s spacecraft business and its role in the company’s end-to-end space strategy
– Insights into launch market dynamics, from smallsat needs to Starship’s impact on the industry

And much more...",69,21,https://youtu.be/FdrKAc2AYZc?si=xZ5-g6DPB9d1hp6M
"Kineis IoT on X: Our third mission ""ICE AIS BABY"" is scheduled to launch on November 23, 2024 by @RocketLab! Launch times: UTC 03:55 AM, FR 04:55 AM, NZDT 4:55 PM, EST 10:55 PM (Day -1)",,39,2,https://x.com/KineisIoT/status/1858548133250114034
Rocket Lab TWO Missions in One WEEK - Explained!,,19,0,https://youtu.be/L6GqH89qFrQ
Rocket Lab is gearing up for a potentially record-breaking week with back-to-back launches within 48hrs on two continents,,226,26,https://x.com/SpaceInvestor_D/status/1858315873221853199
"Rocket Lab is currently making progress on the next 3 developments for its Neutron vehicle, what are the chances they are on schedule to launch for the first time in ~6-7 months, and no major issues ?",,130,27,https://i.redd.it/n8nt21le8i1e1.jpeg
Rocket Lab Signs Multi-Launch Contract for Neutron with Confidential Commercial Satellite Constellation Operator,,251,23,https://www.businesswire.com/news/home/20241112146940/en/Rocket-Lab-Signs-Multi-Launch-Contract-for-Neutron-with-Confidential-Commercial-Satellite-Constellation-Operator
Rocket Lab Granted Air Force Research Lab Award to Showcase Digital Engineering with New Archimedes Rocket Engine,,116,5,https://www.businesswire.com/news/home/20241112337882/en/Rocket-Lab-Granted-Air-Force-Research-Lab-Award-to-Showcase-Digital-Engineering-with-New-Archimedes-Rocket-Engine
Rocket Lab US headquarters threatens NZ academic with defamation action.,,79,24,https://www.rnz.co.nz/news/national/533616/rocket-lab-us-headquarters-threatens-nz-academic-with-defamation-action
Rocket Lab Attempt to OUTBID SpaceX for Pentagon Contract!,,61,32,https://youtu.be/5Ss8CgbHR6A
Is Rocket Lab in risk of having government contracts cancelled due to SpaceX conflic of interests?,Or am I overthinking this way too much? ,22,76,https://www.reddit.com/r/RocketLab/comments/1goo815/is_rocket_lab_in_risk_of_having_government/
"Rocket Lab @ X - ""You're never just a little gear in a giant machine. You get given huge responsibilities within the company. Don't expect 9-5, but do expect to have an actual  meaningful impact on the world.""",Rocket Lab is currently hiring for over 300+ positions.  Why is Rocket Lab doing a massive hiring spree?,123,22,https://x.com/rocketlab/status/1854600088221540413?s=61
Is the Neutron on Rocket Lab's website the current design?,As I've said in my last post in this sub I am building Neutron in Lego. Now I typically browse the web for designs to recreate however there are so much designs for Neutron that I am not sure which is the current design. Is the one on their website the current design?,15,15,https://www.reddit.com/r/RocketLab/comments/1glnifq/is_the_neutron_on_rocket_labs_website_the_current/
Is this fucking serious?!,I got this in my Twitter feed. Is this some crazy scam or what?  How the fuck can rocket lab stoop to something so bizarrely off brand?,66,43,https://i.redd.it/99k3fmxhcdzd1.jpeg
Lego Rocket Lab Electron(Minifig scale),,28,7,https://www.reddit.com/gallery/1gkvfmy
Rocket Lab on Twitter: Payload deployed 🛰️ Mission success for our 54th Electron launch.,,192,9,https://x.com/RocketLab/status/1853771586027032585
Rocket Lab confirms plan to bid for Pentagon launch contracts with new medium rocket,,281,9,https://spacenews.com/rocket-lab-confirms-plan-to-bid-for-pentagon-launch-contracts-with-new-medium-rocket/
@Rocket Lab - Behind the scenes at LC-2 and LC-3 with @maddireidy as we prepare for Neutron's first launch.,Nice to see the company start to promote the upcoming Neutron launch. 🚀 ,66,5,https://x.com/rocketlab/status/1851338974385881099?s=61
total space market & the role of investment and debt issuance. Rocket Lab honorably mentioned several times,,25,1,https://youtu.be/tdqbbevBf1k?si=6zaZGDPCjoWjMxww
Rocket Lab founder Peter Beck reveals his vision for the space industry’s future ,,55,17,https://youtu.be/iiaJA4Zlojw?si=5slw_47CMpsn8I7D
First look: Rocket Lab's Neutron launch site,,69,9,https://www.youtube.com/watch?v=I4VtCBX2d4s
Rocket Lab proposes $2B solution for faster Mars Sample Return as NASA reviews options,,190,55,https://spaceexplored.com/2024/10/24/rocket-lab-proposes-2b-solution-for-faster-mars-sample-return-as-nasa-reviews-options/
"Rocket Lab on Twitter: Launch update 🚀: The next Electron launch is scheduled for no earlier than November 4th from LC-1. Launch window opens: NZDT 11:30 pm, UTC 10:30, ET 6:30 am, PT 3:30 am",,49,2,https://x.com/RocketLab/status/1849939221735407913
Maybe we can get another fire sale like with Virgin Orbit,"I know everyone has the whole “if it’s Boeing I ain’t going” mentality. But Virgin didn’t exactly have the best track record either, and the assets Rocket Lab got at a discount proved to be very useful. I’m curious on if this could bear similar fruit.",32,56,https://finance.yahoo.com/news/boeing-explores-sale-space-business-162604851.html
"@Madison Reidy  - Get ready. Tour of @RocketLab USA launch site in Wallops Island, Virginia coming soon. Includes a reveal of Neutron’s launchpad. ",,69,2,https://x.com/maddireidy/status/1848977558911492125?s=61
Interview Rocketlab,I've been invited for an interview as a IT Systems Engineer (NZ). Do you guys any experience or tips? Any advise will do.,26,13,https://www.reddit.com/r/RocketLab/comments/1g97pfm/interview_rocketlab/
"2 month TAT contract to Launch, very impressive!","RKLB scalability on display here!

https://investors.rocketlabusa.com/news/news-details/2024/Rocket-Lab-Adds-New-Mission-to-2024-Launch-Manifest-Schedules-Launch-in-Coming-Days/default.aspx",25,4,https://www.reddit.com/r/RocketLab/comments/1g8x0ft/2_month_tat_contract_to_launch_very_impressive/
"What are your thoughts on Stoke Space, will it be a serious rival to Rocket Lab or will it end up bankrupt?",,25,43,https://www.reddit.com/r/RocketLab/comments/1g8soqm/what_are_your_thoughts_on_stoke_space_will_it_be/
What “mega-constellations” do you think Peter Beck is referring to? And by whom ?,Is he referring to a satellite constellation built by Rocket Lab? Or ones from other companies or government agencies?  Do you think it would be similar to SpaceX starlink ?,80,20,https://www.reddit.com/gallery/1g88tu9
Rocket Lab on Twitter: Launch update 🚀 we're taking a few extra days to perform final checkouts ahead our next mission. Updated launch date to come toward the end of next week.,,45,0,https://x.com/RocketLab/status/1847084746213675053
Employement at RocketLab NZ,Hey folks! I recently applied for a roll with Rocket Lab NZ as a vehicle integration tech (avionics) and after a phone interview I have been invited for an onsite interview/assesment. I'm curious to know if anyone has gone through this process and could maybe give some advice on what to expect or on how one should prepare for it. I also would appreciate anyone's personal experiences working for Rocket Lab NZ and how they find them as an employer. TIA ,5,6,https://www.reddit.com/r/RocketLab/comments/1g66mbi/employement_at_rocketlab_nz/
Discussion/speculation: how long until Rocketlab builds a starship competitor? ,Obviously we’ve all been seeing starship development and I am a huge fan of all modern space companies. Sometimes I wonder when my favorite company will build something like starship. I think it’s inevitable but I just wonder how long but I think development starting in a decade is realistic. ,29,89,https://www.reddit.com/r/RocketLab/comments/1g5r5o4/discussionspeculation_how_long_until_rocketlab/
"Rocket Lab on Twitter: New mission alert 🚨 We’ve added an extra mission to our launch line-up this year, launching in just three days’ time for a confidential commercial customer. From contract to space in less than two months. Launching NET Saturday 19 October.",,209,18,https://x.com/RocketLab/status/1846651409351299510
Adam Spice CFO of Rocket Lab during the Bloomberg interview.  ,,92,7,https://www.reddit.com/gallery/1g1ysta
Ed Ludlow from Bloomberg will be doing a live interview with Adam Spice tomorrow at Rocket Lab headquarters.  What do you think will be discussed?,,65,9,https://i.redd.it/ytji2p0gy0ud1.jpeg
Can Rocket Lab come to NASA's rescue with new Mars sample-return plan?,,63,5,https://www.space.com/rocket-lab-mars-sample-return-proposal-nasa
Public viewing events for Rocket Lab launches,"hey Rocket Lab fam,

I've been wondering, does Rocket Lab ever allow the public to attend launches? Or is it just reserved for  clients whose satellites are going up? I know SpaceX and Blue Origin (New Shepard) have public viewing events, but I haven't seen much about Rocket Lab doing something similar. ",17,17,https://www.reddit.com/r/RocketLab/comments/1fzditb/public_viewing_events_for_rocket_lab_launches/
Rocket Lab Awarded NASA Study Contract to Explore Bringing Rock Samples from Mars to Earth for the First Time,,127,8,https://www.stocktitan.net/news/RKLB/rocket-lab-awarded-nasa-study-contract-to-explore-bringing-rock-ccg7fha2rvna.html
New Moderators Wanted,"Hi all, 

Firstly thanks to everyone who has been contributing to this subreddit and making it the community it is today.

Life has kept me busy this past year and as such the mod team hasn't been too active. 
So with that, I'm keen to add one or two more mods to the team here and would love any existing users who have engaged to:

* ""[Message the Mods](https://www.reddit.com/message/compose/?to=/r/RocketLab)"" with a list of your posts and overall engagement with the subreddit, what you'd like to assist with and why.

Once I've any applicants I'll review, decide and let the users know individually. 

Cheers

JD",54,3,https://www.reddit.com/r/RocketLab/comments/1fw61m1/new_moderators_wanted/
Full Bloomberg Space Special Lineup @ Rocket Lab HQ on 10/11/24,,41,4,https://i.redd.it/bxtbic9vqesd1.png
Where's the hop test vehicle?,"I am new to reddit but not new to NewSpace. I realize this is my first post and thus anticipate some downvotes.

I have a lingering thought. For Neutron reusability, where is the hop test vehicle? And if it is partially built, why has Rocket Lab not shared it's progress? Electron's 1st stage ability to come back to an area above the ocean via parachutes, to then be caught by a helicopter, was an interesting idea that never materialized. Bringing Neutron back to the Wallops pad, at a precise location, is much more challenging. And doing that landing on a floating barge is much more difficult. Why no word on the barge build?

Is Neutron going to have an expendable version for it's first handful of flights?",10,40,https://www.reddit.com/r/RocketLab/comments/1fskofd/wheres_the_hop_test_vehicle/
"@SpaceStocks：According to the Federal Procurement Data System (fpds.gov/ezsearch/fpdsp…), Rocket Lab has been awarded a contract by NASA to ""provide rapid studies for the Mars Sample Return (MSR) program."" The contract was awarded on September 27th and is worth $625,000. There were 49 offers ",,77,4,https://x.com/SpaceEquities/status/1839972593853444224?t=B11P4cYYl0mxml8yKaBavg&s=34
Rocket Lab is the future of space exploration and satellite technology.,"With industry legends like Peter Beck at the helm and a powerhouse team including former execs from Lockheed Martin and Mercedes-Benz, this company is set to skyrocket. 

Why should you care? Because investing in Rocket Lab isn't just about making money—it's about being part of something bigger. It's about innovation, pushing boundaries, and riding the wave of the next big thing. 

Imagine telling your friends you got in early on a company that's revolutionizing space travel. Pretty badass, right? Plus, with three launch pads ready to go, Rocket Lab is primed to meet the growing demand for satellite launches.

Take your investments to the next level and be part of the future.
",13,43,https://www.reddit.com/r/RocketLab/comments/1fr373v/rocket_lab_is_the_future_of_space_exploration_and/
Electron payload,"When I looked up some light rockets from private space companies, I noticed that the payload of electron seems to be at the lower end. Like 300kg to LEO? Other rockets have somewhere between 500-1000kg to LEO. The coming Neutron would be a fair competitor to Falcon 9, but what makes rocket lab different from others if Electron is their only operational rocket for now? Is it because most of the commercial satellites fall below the 300kg range so it’s more cost effective to launch with Electron?",10,24,https://www.reddit.com/r/RocketLab/comments/1fqsbtz/electron_payload/
Rocket Lab on Twitter: Exciting News! Rocket Lab has completed its second Pioneer spacecraft for @VardaSpace enabling them to push the boundaries of in space manufacturing!,,91,3,https://x.com/RocketLab/status/1839329914568523827
Rocket Lab Satellite Launch Puts SpaceX Challenger Back on Track,,73,0,https://www.bloomberg.com/news/articles/2024-09-20/rocket-lab-satellite-launch-puts-spacex-challenger-back-on-track
